{
  "schema_version": "0.1",
  "freeze_id": "gate-m-real-tasks-2026-08-02-pre-review-v1",
  "created_at": "2026-08-02T07:00:00Z",
  "phase": "gate_m_method_validation",
  "status": "pre_review",
  "capability_claim_permitted": false,
  "code_identity": {
    "commit": "ac1e3f5987dcc8610e1bcc883754d0de58e4f880",
    "tree": "b23499bd975d56a051739a7ca024ddb86513e49e"
  },
  "model_execution": {
    "live_model_calls": false,
    "adapter_id": "deterministic-test-double",
    "adapter_sha256": "87226387ebb4f57ee813e9e45391b99df3159cec3693567a5727deb8a9dda111",
    "model_snapshot": "test-double/not-a-model@fixture-1",
    "reasoning_effort": "none",
    "prompt_sha256": null,
    "skill_sha256": null
  },
  "review": {
    "policy_sha256": "8c710398cff6f2955771642235c1089a6f61800540672c0a7a119a7e6636098d",
    "blinded_schedule_sha256": "da059547d5a0d9bbb4d2744f8c2fcad7f49ccbf3bf9dd794a2be7a7fbd5fa18e",
    "required_distinct_reviewers": 2,
    "completed_distinct_reviewers": 0,
    "agreement_status": "pending"
  },
  "treatment_execution": {
    "executable": false,
    "schedule_sha256": null,
    "blocked_by": [
      "independent semantic reviews incomplete",
      "no approved intervention packets",
      "L3/L4 collapse decision pending"
    ]
  },
  "scorer": {
    "source_path": "src/scoring.ts",
    "source_sha256": "63cfba421d028f18326c144438e313b950faf462fb187ac07154868846a2b601",
    "classification": "interface_blind_host_confidentiality_not_enforced"
  },
  "pricing": {
    "path": "data/pricing/openai-2026-08-02.evidence.json",
    "sha256": "d58b6f84a329744106cd3f730b7c0719e815c05d44353bc400e170ad5d113aac",
    "snapshot_id": "openai-standard-pricing-2026-08-02"
  },
  "tasks": [
    {
      "task_id": "zod-tuple-default",
      "manifest_sha256": "fa47fe2600b55604995e0ef97185f8eaecfd7319e178e84e76922976925eca96",
      "base_commit": "ec979ad783a9e9c992d3c9bd4e5f3b56110b1ef8",
      "corrected_commit": "b6066b3e4730fc8b966d13974b4abae8dce25df4",
      "evaluator_sha256": "11b21860e83fe0dcbfd09d193d31ef38dffe7a387eedea98c7b46a8336cc6909",
      "environment_definition_sha256": "75baf38b9f23a2ca98447e678229fa5f1e7d2a70787171a4ba2c7304182a8751"
    },
    {
      "task_id": "zod-absent-catch",
      "manifest_sha256": "2624d2b192a1a69f36833b5712c8fa9515ee1cc9560ffb4d078245763ef407e7",
      "base_commit": "b8dffe9e62f17e6571e6249d05cc5102b54d94e4",
      "corrected_commit": "1cab69383fcdeae2a366d5e2a2fc4d8fc765d168",
      "evaluator_sha256": "f27d0c012fd00c750bbf097d051c8c900cfee4231cbcdcaa6af4c05f82213d79",
      "environment_definition_sha256": "1a6a067cf294c9107ad6f1edba30b0405c8986da71f25559ace7a453f0decb3c"
    },
    {
      "task_id": "date-fns-zh-month",
      "manifest_sha256": "b6cea9f3d64a3d28842a10afbe742008951cfc293fef6a53c9fce644791afcf8",
      "base_commit": "39d1e14200cead9e4be5df88695b5e82082875ed",
      "corrected_commit": "b9c5865edb7610c59e6b3694ed1e1691f4807688",
      "evaluator_sha256": "8511e0d97221d4151015d39c7dd223ff24caf86956d85250830821d3a528b38f",
      "environment_definition_sha256": "1ac4b45beb4c3550311130c225033e7ca6aa1416db3097c11303915a80908425"
    },
    {
      "task_id": "type-fest-conditional-keys",
      "manifest_sha256": "ca3aff1d3ea62788e15e04c152acc1a133c5ef004dd71bd36defdab7b3df98d2",
      "base_commit": "b6d8dd60726a8d7df5a5eea3b3c9d830804d2570",
      "corrected_commit": "0fb2d62f7d222d3effb0ad89d5b340e36285bcc4",
      "evaluator_sha256": "14f1c3a2740d2e542a115df6277e5da8ed515c967cc518748dde60937714e1d1",
      "environment_definition_sha256": "ffb4539e0105978c75fdfc544244b9b294a3fc9c28de826c70469dd8a1354afa"
    }
  ],
  "artifacts": [
    {
      "role": "pricing",
      "path": "data/pricing/openai-2026-08-02.evidence.json",
      "sha256": "d58b6f84a329744106cd3f730b7c0719e815c05d44353bc400e170ad5d113aac"
    },
    {
      "role": "adapter",
      "path": "fixtures/smoke/deterministic-adapter.mjs",
      "sha256": "87226387ebb4f57ee813e9e45391b99df3159cec3693567a5727deb8a9dda111"
    },
    {
      "role": "protocol",
      "path": "package-lock.json",
      "sha256": "433c47ddda22cc300af807993933e70ee2d8b544a4a5b63445497a3bdd3ce496"
    },
    {
      "role": "protocol",
      "path": "package.json",
      "sha256": "efc11bf4f03e111ff7f1df39874a7e9197e4291dbaf2cc79c3cc168dd5763d9d"
    },
    {
      "role": "protocol",
      "path": "research/intervention-authoring-rubric.md",
      "sha256": "8e79dcd4c16b84ad64830884149fbddb78e4031d9d8628de1af480c93d693bb8"
    },
    {
      "role": "protocol",
      "path": "research/method-validation-plan.md",
      "sha256": "7a7d92fda9963c37c173a60f08e56089c367f9646e4f9cd58b133fc7b1e8159b"
    },
    {
      "role": "code",
      "path": "schemas/gate-m-study-freeze.schema.json",
      "sha256": "ea180ffa3c785758ad31a908a0f468fdc5c1356cfb02798d4c6bddd84ed08706"
    },
    {
      "role": "code",
      "path": "schemas/intervention-draft.schema.json",
      "sha256": "09dd02c57605da6ae069ac6b7b32bfa64bcd546fe278df70165daf8ccfb0f5de"
    },
    {
      "role": "code",
      "path": "schemas/intervention-packet.schema.json",
      "sha256": "dd2a53f64ce372df146f2c3153664aab045bc9fa36cb0115e3438dd749210731"
    },
    {
      "role": "code",
      "path": "schemas/intervention-review.schema.json",
      "sha256": "16525911f871fb3fa3c78cb2a5aa26b4c6c914ee95c1bdab316715ccab3791a8"
    },
    {
      "role": "code",
      "path": "schemas/run-receipt/schema.json",
      "sha256": "918c3c186f599e8102635fab1550122b2c0d7159556c720300f370168139100c"
    },
    {
      "role": "code",
      "path": "schemas/task-manifest.schema.json",
      "sha256": "e2e80527eb9ecc6a35c29d2e148f8e8c8108e8fa4891ba893323ee0bed24557e"
    },
    {
      "role": "code",
      "path": "schemas/task-pool.schema.json",
      "sha256": "387f43485fbd82ba47966bbfd570829ad59fb1347feb0c84dfe57cc080ba1eca"
    },
    {
      "role": "code",
      "path": "scripts/gate-m/freeze-study.mjs",
      "sha256": "deab7277108f8181b1c698e694a1d3803fce6f149c0947dadf4dda41f945f3b8"
    },
    {
      "role": "code",
      "path": "scripts/gate-m/generate-intervention-drafts.mjs",
      "sha256": "f637dbcbb70c74c51b354497a654642ab99120bdfbe578003513417d9add7ff0"
    },
    {
      "role": "code",
      "path": "scripts/gate-m/generate-review-bundles.mjs",
      "sha256": "f47ff17dc433a50625f94e68dbad9190f69dcef0a7e4501a4ed2bf50fa2032b9"
    },
    {
      "role": "code",
      "path": "scripts/gate-m/validate-real-tasks.mjs",
      "sha256": "89afa7bb9b859d07d284e08dfa9ffb825bff31a7d0dc7aed434be0048588ccf3"
    },
    {
      "role": "code",
      "path": "src/environment.ts",
      "sha256": "1996ad17d708d0d72874be4f0f8e09671bfd8220b0ff3b1ac5251d3bba721ef8"
    },
    {
      "role": "code",
      "path": "src/errors.ts",
      "sha256": "a4000672bfcf535a4f5aa3b899bd4242307aa9d865f4525f8b20ff2398110766"
    },
    {
      "role": "code",
      "path": "src/gate-m-freeze.ts",
      "sha256": "7251a2eeb34f9cd234d618368d3987536c9665aa6e9e593e7f4fef2cb5e652cf"
    },
    {
      "role": "code",
      "path": "src/intervention-drafts.ts",
      "sha256": "0181087071e8fb9772726cd76c83a18c469adb2ac0e7316c7a7e67ba161a5967"
    },
    {
      "role": "code",
      "path": "src/interventions.ts",
      "sha256": "c3416c99f90f2d96e59af84a94d3bd1b608b1edfba6565bec72e7e037b6515d1"
    },
    {
      "role": "code",
      "path": "src/process.ts",
      "sha256": "fe906f671581798f1aaec84923d23bd6491686496787fe0d0cd0ade4839767a2"
    },
    {
      "role": "code",
      "path": "src/runner.ts",
      "sha256": "ba09d9ab8cba333d51082aafe6f66eedbc2384e14f0c292dbf25722f1e7d784d"
    },
    {
      "role": "scorer",
      "path": "src/scoring.ts",
      "sha256": "63cfba421d028f18326c144438e313b950faf462fb187ac07154868846a2b601"
    },
    {
      "role": "code",
      "path": "src/types.ts",
      "sha256": "743b8f3435c79213bf1024dc82f8f4ad1c72667f27f92f04ca7c870628f0951c"
    },
    {
      "role": "protocol",
      "path": "tasks/gate-m/SOURCES.md",
      "sha256": "be594c7908c505b8c91438bc4f97ec38ef2392bf35b96869813d51b629ff3a30"
    },
    {
      "role": "task",
      "path": "tasks/gate-m/candidate-pool.json",
      "sha256": "9ed3920293cba06e1053c71b58dd03383bf42f8e670dec12e855ce4a1b4cc2c6"
    },
    {
      "role": "protocol",
      "path": "tasks/gate-m/date-fns-zh-month/control/base-commit.txt",
      "sha256": "fef30fbafed50eaaeff2e853772e36e648a150ea030f60602c28a33b6703baf0"
    },
    {
      "role": "protocol",
      "path": "tasks/gate-m/date-fns-zh-month/control/corrected-commit.txt",
      "sha256": "60bf620c8ff0c0bf3c29d77611ccc57f099afe35e0e061b442e260fc2ce107b9"
    },
    {
      "role": "evaluator",
      "path": "tasks/gate-m/date-fns-zh-month/control/evaluator/verify.mjs",
      "sha256": "8511e0d97221d4151015d39c7dd223ff24caf86956d85250830821d3a528b38f"
    },
    {
      "role": "protocol",
      "path": "tasks/gate-m/date-fns-zh-month/control/known-repair.patch",
      "sha256": "486708ccc895b9b87a90c8fb582abd546441f4404f6e741b38de6fef899ba55c"
    },
    {
      "role": "environment",
      "path": "tasks/gate-m/date-fns-zh-month/control/task-validation.json",
      "sha256": "1ac4b45beb4c3550311130c225033e7ca6aa1416db3097c11303915a80908425"
    },
    {
      "role": "protocol",
      "path": "tasks/gate-m/date-fns-zh-month/intervention-authoring.json",
      "sha256": "434e018b8641616c0b7b26e244cc62860ee202bda951c848d7302577572330d3"
    },
    {
      "role": "intervention_draft",
      "path": "tasks/gate-m/date-fns-zh-month/interventions/L1.json",
      "sha256": "957899b88788bedd013deca2b1f5041abe73af18ace6accdde74395de0b18be9"
    },
    {
      "role": "intervention_draft",
      "path": "tasks/gate-m/date-fns-zh-month/interventions/L2.json",
      "sha256": "ab9df745edd78acfbc24eebc42fd9130d0defdd757010f0e4cfb80fe200484ed"
    },
    {
      "role": "intervention_draft",